{
  "ACTS": [
    {"n": 1, "name": "Act I", "question": "What happened to Ilsa?", "gate": null, "opens": "From the start"},
    {"n": 2, "name": "Act II", "question": "Who were the Old Keepers?", "gate": {"deepest": 4}, "opens": "Reach the veins on Floor 4"},
    {"n": 3, "name": "Act III", "question": "What is the Bloom?", "gate": {"deepest": 7}, "opens": "Reach the Underheart on Floor 7"},
    {"n": 4, "name": "Act IV", "question": "What will you do with it?", "gate": {"ilsa": true}, "opens": "Free Ilsa on Floor 9"}
  ],
  "RANK_PAGES": {"1": [1, 1], "2": [1, 2], "3": [1, 3], "4": [1, 8], "5": [1, 6], "6": [1, 9], "7": [2, 11], "8": [2, 12], "9": [2, 17], "10": [3, 20], "11": [3, 23], "12": [3, 25], "14": [3, 27]},
  "PAGES": [
    {"id": "clover", "n": 4, "act": 1, "find": {"floor": 1}, "title": "Pressed flower", "text": "I went back for the flower that grew where Clover fell. It has her ears, two soft petals that twitch when I hum. I pressed it in this book. Turn the page carefully."},
    {"id": "ringing", "n": 5, "act": 1, "find": {"floor": 2}, "title": "Walls that ring", "text": "Pip says the Bloom hides rooms behind walls that ring. I struck one today and it answered with a note from the deep song, the one I keep humming. The Bloom has a voice, and it uses it to keep secrets."},
    {"id": "digging", "n": 7, "act": 1, "find": {"floor": 2}, "title": "Biscuit digs", "text": "Biscuit has started digging toward the deep at night, the way the wild ones do. Her tether is cut. I watched it fall away. So what is still calling her?"},
    {"id": "moved", "n": 10, "act": 1, "find": {"floor": 3}, "title": "A map with a hole in it", "text": "Pip's map of Floor 3 has a hole where the boss room should be. She swears she drew it, then the room moved. Boss rooms never move. Something moved it to keep me away from what Biscuit became."},
    {"id": "ledger", "n": 13, "act": 2, "find": {"vein": "ember"}, "title": "The camp ledger", "text": "Copied from a ledger in the Abyss camp: 'Day 212 of the Planting. Seed vaults full. The Bloom takes well. Coal for the forge, bread for forty Keepers.' Forty. There were forty of them, and they called it a planting."},
    {"id": "pumps", "n": 14, "act": 2, "find": {"vein": "drowned"}, "title": "The pumps", "text": "The Old Keepers built pumps to keep the galleries dry. Pumps mean years of work, not a season. This was never a camp. It was a post. They were tending something, the way I tend the garden."},
    {"id": "crowns", "n": 15, "act": 2, "find": {"vein": "choir"}, "title": "Three crowns", "text": "Three crowns on a ledge in the Choir dark, set down neatly, like someone took them off to sleep. Not kings' crowns. Gardeners' wreaths, cast in iron so they would last."},
    {"id": "chimes", "n": 16, "act": 2, "find": {"vein": "spires"}, "title": "Chimes", "text": "The wind in the Spires blows down, always down, toward the heart. The Old Keepers hung chimes on every ledge so they could find their way back up by sound. They meant to come back up. Most of them did."},
    {"id": "cribnote", "n": 18, "act": 2, "find": {"floor": 6}, "title": "The same shapes", "text": "I have copied the rune line from twelve walls now. Same shapes every time, in the same order. If it really says KEEP IT ASLEEP, then the second shape is E, it comes twice, and the last word starts with the same shape as the second word ends. With patience I can read every wall in the Bloom."},
    {"id": "medicine", "n": 19, "act": 2, "find": {"vein": "sump"}, "title": "Medicine for creatures", "text": "Their medicine stores are in the Sump. Every bottle is labeled for creatures, none for people. Either the Keepers never fell sick down here, or they did not think of themselves as anything different."},
    {"id": "drill", "n": 21, "act": 3, "find": {"floor": 7}, "title": "The drill", "text": "The Keepers' digging engine has a plate on its side: DIG TO THE HEART. CUT NOTHING. Why build a drill that is forbidden to cut? Unless they only ever meant to listen."},
    {"id": "onebody", "n": 22, "act": 3, "find": {"floor": 7}, "title": "One body", "text": "Sorrel was right. Down here the roots are warm and they have a pulse, one pulse, in every hall at once. We are not exploring a dungeon. We are walking around inside something that is asleep."},
    {"id": "scar", "n": 24, "act": 3, "find": {"floor": 8}, "title": "The scar", "text": "I found it this morning. A thin white line over my heart, like a healed thread. My mother had one. I always thought it was a burn from the forge."},
    {"id": "thirdvoice", "n": 26, "act": 3, "find": {"floor": 8}, "title": "The third voice", "text": "The song has three voices. Two are old and tired. The third is younger, and it sings the same three notes my grandmother sang over my cradle. A Marrow sang here before me."},
    {"id": "why", "n": 28, "act": 3, "find": {"floor": 9}, "title": "Why I went", "text": "If Keepers carry the thread too, then the Bloom has been calling us home all along. The singers are failing. Someone has to hold the song. It should be someone who belongs to it."},
    {"id": "rest", "n": 29, "act": 4, "find": {"rest": true}, "title": "To you", "text": "If you found this room, you read the walls. Good. The Old Keepers rest here: three chairs, two of them still warm. Mine is the third. Whatever you decide at the Heart, decide it awake. — Ilsa"},
    {"id": "after", "n": 30, "act": 4, "find": {"ending": true}, "title": "After", "text": "A new entry, in Ilsa's hand, on the last page: I can hear the hills again. The roots stopped singing and I did not stop breathing. Thank you for coming down. Thank you for not leaving me there."}
  ],
  "WALLS": [
    {"id": "asleep", "text": "KEEP IT ASLEEP", "act": 1, "find": {"floor": 2}},
    {"id": "dies", "text": "WHAT DIES INSIDE GROWS BACK", "act": 1, "find": {"floor": 1}},
    {"id": "keepers", "text": "WE ARE THE KEEPERS OF THE ARK", "act": 1, "find": {"floor": 3}},
    {"id": "withering", "text": "THE WORLD ABOVE WAS WITHERING", "act": 2, "find": {"vein": "ember"}},
    {"id": "planted", "text": "WE PLANTED THE BLOOM BELOW TO HOLD WHAT WAS LEFT", "act": 2, "find": {"vein": "drowned"}},
    {"id": "dream", "text": "WE SANG SO IT WOULD DREAM", "act": 2, "find": {"vein": "choir"}},
    {"id": "teeth", "text": "ITS DREAMS HAVE TEETH", "act": 2, "find": {"vein": "spires"}},
    {"id": "eclipse", "text": "VENOM WED TO LIGHT MAKES AN ECLIPSE", "act": 2, "find": {"vein": "sump"}, "secret": "hybrid"},
    {"id": "three", "text": "THREE STAYED BELOW TO KEEP THE SONG", "act": 2, "find": {"floor": 6}},
    {"id": "healed", "text": "THE WORLD HEALED LONG AGO", "act": 3, "find": {"floor": 7}},
    {"id": "thread", "text": "WE TOO CARRY THE THREAD", "act": 3, "find": {"floor": 7}},
    {"id": "thrice", "text": "BRED TRUE THRICE THE BLOOM LETS GO", "act": 3, "find": {"floor": 8}},
    {"id": "marrow", "text": "THE THIRD SINGER WAS MARROW", "act": 3, "find": {"floor": 8}, "secret": "singer"},
    {"id": "door", "text": "A DOOR SLEEPS BESIDE THE HEART", "act": 3, "find": {"floor": 9}, "secret": "room"},
    {"id": "afraid", "text": "IT IS NOT CRUEL IT IS AFRAID", "act": 3, "find": {"floor": 9}},
    {"id": "choice", "text": "WAKE IT OR CUT IT FREE OR SING IT HOME", "act": 4, "find": {"floor": 10}}
  ],
  "SECRET_HYBRID": "eclipsar",
  "WHISPER": {"chance": 0.005, "note": "Rolled once per room entered, with the visual-only random so seeded raids never shift."},
  "WHISPERS": [
    {"id": "laugh", "act": 1, "text": "Somewhere behind the walls, a girl laughs. Then nothing."},
    {"id": "listen", "act": 1, "text": "Your companion stops and turns toward the deep, ears up, listening to something you can't hear."},
    {"id": "notthis", "act": 1, "text": "A voice, very close to your ear: \"Not this one. This one goes home.\""},
    {"id": "musicbox", "act": 1, "floor": 3, "text": "For one bar, the walls hum the tune from the music box on Ilsa's desk."},
    {"id": "counting", "act": 2, "vein": "ember", "text": "The coals whisper numbers as you pass. Forty. Thirty-nine. Thirty-eight."},
    {"id": "pump", "act": 2, "vein": "drowned", "text": "Under the water, a pump turns over once, as if someone remembered it."},
    {"id": "breath", "act": 2, "vein": "choir", "text": "In the dark, three voices take a breath together, and hold it."},
    {"id": "chime", "act": 2, "vein": "spires", "text": "A chime rings on a ledge where no wind reaches. It rings upward."},
    {"id": "recipe", "act": 2, "vein": "sump", "text": "The poison bubbles out half a word, something like \"eclipse\", then forgets it."},
    {"id": "glow", "act": 2, "text": "A rune on the wall glows as you pass, the way a word does when you finally understand it."},
    {"id": "breathing", "act": 3, "text": "The floor rises and falls under your feet. Slowly. Asleep."},
    {"id": "areyou", "act": 3, "text": "A voice hoarse from a hundred years of singing: \"Are you a Marrow? You walk like one.\""},
    {"id": "ache", "act": 3, "text": "Your own chest aches, right where a thread would be."},
    {"id": "stay", "act": 4, "text": "The Bloom speaks in every voice it has ever kept, all at once: \"Stay.\""},
    {"id": "hum", "act": 4, "text": "Ilsa, beside you, humming: \"It only ever wanted someone to stay. Let's show it what leaving looks like.\""}
  ],
  "MURALS": [
    {"id": "gardeners", "name": "The Gardeners", "where": "Cliff face above the gate", "pal": ["#3a5a2a", "#9fd860", "#f6eedb"], "motif": "ring",
      "stages": ["Faded figures with trowels kneel in a ring around a single seed.", "The paint has darkened. The seed has roots now, and forty gardeners stand around it holding hands.", "The roots reach the edge of the wall. Three gardeners sit apart from the others, mouths open, singing.", "A fourth figure kneels beside the three, with a red braid like Ilsa's. Someone has painted her in fresh."]},